{
  "operationId": "947",
  "languageCode": "en",
  "transactionCode": "69",
  "userId": "1:25",
  "password": "1234:4321",
  "customerLogin": "10111",
  "customerNewLogin": "",
  "customerPassword": "xxxx",
  "customerTitle": "Mr",
  "customerFirstName": "koteswararao",
  "customerMiddleName": "",
  "customerLastName": "sunkavalli",
  "customerGender": "Male",
  "customerBirthdate": "YYYY-MM-DD",
  "customerAddress": "23 Anyroad St.,Suite 100|London|GU1 3UY|UK|Greater London",
  "customerAddress2": "23 Anyroad St.,Suite 100|London|GU1 3UY|UK|Greater London",
  "customerCity": "London",
  "customerProvince": "North Yorkshire",
  "customerCounty": "",
  "customerCountry": "",
  "customerPostalCode": "",
  "customerEmail": "koteswararao.sunkavalli@whishworks.com",
  "customerPhone": "",
  "customerDiscount": "",
  "promotionOptIn": "",
  "customerMobile": "",
  "customerCompany": ""
}
